{
  "$schema": "https://json-schema.org/draft/2020-12/schema",
  "$id": "sipi.artifact-ref.v1",
  "type": "object",
  "required": ["schema", "content_schema", "relative_path", "mime_type", "sha256", "byte_length", "producer", "role", "extensions"],
  "properties": {
    "schema": {"const": "sipi.artifact-ref.v1"}, "content_schema": {"type": "string", "minLength": 1},
    "relative_path": {"type": "string", "pattern": "^(?!/)(?!.*\\\\)(?!.*:)(?!.*//)(?!.*(?:^|/)\\.{1,2}(?:/|$))[A-Za-z0-9][A-Za-z0-9._/-]*$"},
    "mime_type": {"type": "string", "pattern": "^[a-z0-9][a-z0-9!#$&^_.+-]*/[a-z0-9][a-z0-9!#$&^_.+-]*$"},
    "sha256": {"type": "string", "pattern": "^[0-9a-f]{64}$"}, "byte_length": {"type": "integer", "minimum": 0},
    "producer": {"type": "string", "minLength": 1}, "role": {"type": "string", "pattern": "^[A-Za-z][A-Za-z0-9._-]*$"},
    "shape": {"type": "array", "minItems": 1, "items": {"type": "integer", "minimum": 0}},
    "dtype": {"enum": ["bool", "int8", "int16", "int32", "int64", "uint8", "uint16", "uint32", "uint64", "float32", "float64", "complex64", "complex128"]},
    "byte_order": {"enum": ["little", "big", "not_applicable"]}, "layout": {"enum": ["C", "F"]},
    "extensions": {"type": "object", "propertyNames": {"pattern": "^[A-Za-z][A-Za-z0-9-]*(?:\\.[A-Za-z0-9-]+)+$"}}
  },
  "allOf": [{"if": {"required": ["shape"]}, "then": {"required": ["dtype", "byte_order", "layout"]}}, {"if": {"required": ["dtype"]}, "then": {"required": ["shape", "byte_order", "layout"]}}, {"if": {"required": ["byte_order"]}, "then": {"required": ["shape", "dtype", "layout"]}}, {"if": {"required": ["layout"]}, "then": {"required": ["shape", "dtype", "byte_order"]}}]
}
