{"schema":"sipi.artifact-ref.v1","content_schema":"fixture.output.v1","relative_path":"artifacts/result.bin","mime_type":"application/octet-stream","sha256":"dc51b8c96c2d745df3bd5590d990230a482fd247123599548e0632fdbf97fc22","byte_length":3,"producer":"fixture.adapter","role":"result","extensions":{}}
